{
  "$schema": "https://json-schema.org/draft/2020-12/schema",
  "title": "RR real-robot latency profile",
  "type": "object",
  "additionalProperties": false,
  "required": [
    "schema_version",
    "measured_at",
    "latency_source",
    "basis",
    "action_stale_guard_ms",
    "front_observation_ms",
    "wrist_observation_ms",
    "robot_observation_ms",
    "gripper_observation_ms",
    "robot_action_ms",
    "gripper_action_ms"
  ],
  "properties": {
    "schema_version": {"const": 2},
    "measured_at": {"type": "string", "minLength": 1},
    "latency_source": {"enum": ["estimated", "measured"]},
    "basis": {"type": "string", "minLength": 1},
    "action_stale_guard_ms": {"type": "number", "minimum": 0},
    "front_observation_ms": {"type": "number", "minimum": 0},
    "wrist_observation_ms": {"type": "number", "minimum": 0},
    "robot_observation_ms": {"type": "number", "minimum": 0},
    "gripper_observation_ms": {"type": "number", "minimum": 0},
    "robot_action_ms": {"type": "number", "minimum": 0},
    "gripper_action_ms": {"type": "number", "minimum": 0},
    "calibrated_fields": {
      "type": "array",
      "items": {
        "enum": [
          "front_observation_ms",
          "wrist_observation_ms",
          "robot_observation_ms",
          "gripper_observation_ms",
          "robot_action_ms",
          "gripper_action_ms"
        ]
      },
      "uniqueItems": true
    },
    "inherited_fields": {
      "type": "array",
      "items": {
        "enum": [
          "front_observation_ms",
          "wrist_observation_ms",
          "robot_observation_ms",
          "gripper_observation_ms",
          "robot_action_ms",
          "gripper_action_ms",
          "action_stale_guard_ms"
        ]
      },
      "uniqueItems": true
    },
    "calibration_clock": {"type": "string", "minLength": 1},
    "calibration_file": {"type": "string", "minLength": 1}
  }
}
